{"artifacts":[{"expires_at":"2026-08-28T02:18:30Z","id":"binary-archive-aarch64-apple-darwin","kind":"binary-archive","name":"sifr-0.1.0-aarch64-apple-darwin.tar.gz","sha256":"1de0e0724764feb150d0669f0cf39fe3cf3c39a75cfef22a4c3275fc18a720e1","size_bytes":71791441,"target":"aarch64-apple-darwin","workflow_artifact_id":8710327423,"workflow_artifact_name":"sifr-stable-candidate-0.1.0-c9d611fb7c7c5d05421d784d53a2b78c1a7dcae9-aarch64-apple-darwin"},{"expires_at":"2026-08-28T02:17:30Z","id":"binary-archive-aarch64-unknown-linux-gnu","kind":"binary-archive","name":"sifr-0.1.0-aarch64-unknown-linux-gnu.tar.gz","sha256":"cf37c395bb051243189cf5374bb93ce6bb11693b99b63a3fce09684ade495de6","size_bytes":72628536,"target":"aarch64-unknown-linux-gnu","workflow_artifact_id":8710312634,"workflow_artifact_name":"sifr-stable-candidate-0.1.0-c9d611fb7c7c5d05421d784d53a2b78c1a7dcae9-aarch64-unknown-linux-gnu"},{"expires_at":"2026-08-28T02:31:06Z","id":"binary-archive-x86_64-apple-darwin","kind":"binary-archive","name":"sifr-0.1.0-x86_64-apple-darwin.tar.gz","sha256":"94460bd10715bc9a4e13aa415217d1c42f5deb1f4d702f91d723b5a4a38182b6","size_bytes":72476442,"target":"x86_64-apple-darwin","workflow_artifact_id":8710519427,"workflow_artifact_name":"sifr-stable-candidate-0.1.0-c9d611fb7c7c5d05421d784d53a2b78c1a7dcae9-x86_64-apple-darwin"},{"expires_at":"2026-08-28T02:18:50Z","id":"binary-archive-x86_64-unknown-linux-gnu","kind":"binary-archive","name":"sifr-0.1.0-x86_64-unknown-linux-gnu.tar.gz","sha256":"3e5d7c18cf82cc4566488d3d04398cbd41420249d40b9f56ad121b9249a875aa","size_bytes":73123139,"target":"x86_64-unknown-linux-gnu","workflow_artifact_id":8710332418,"workflow_artifact_name":"sifr-stable-candidate-0.1.0-c9d611fb7c7c5d05421d784d53a2b78c1a7dcae9-x86_64-unknown-linux-gnu"},{"expires_at":"2026-08-28T02:18:30Z","id":"checksum-aarch64-apple-darwin","kind":"checksum","name":"sifr-0.1.0-aarch64-apple-darwin.tar.gz.sha256","sha256":"2344e27c6b72e38abd58c43cbcd7f606c55b552080f12322ca388f2c59b65e02","size_bytes":65,"target":"aarch64-apple-darwin","workflow_artifact_id":8710327423,"workflow_artifact_name":"sifr-stable-candidate-0.1.0-c9d611fb7c7c5d05421d784d53a2b78c1a7dcae9-aarch64-apple-darwin"},{"expires_at":"2026-08-28T02:17:30Z","id":"checksum-aarch64-unknown-linux-gnu","kind":"checksum","name":"sifr-0.1.0-aarch64-unknown-linux-gnu.tar.gz.sha256","sha256":"54a755ab8408bbe312e8c5117a709e7c29ac38ca54e8d21ac7503e6a242d1f38","size_bytes":65,"target":"aarch64-unknown-linux-gnu","workflow_artifact_id":8710312634,"workflow_artifact_name":"sifr-stable-candidate-0.1.0-c9d611fb7c7c5d05421d784d53a2b78c1a7dcae9-aarch64-unknown-linux-gnu"},{"expires_at":"2026-08-28T02:31:06Z","id":"checksum-x86_64-apple-darwin","kind":"checksum","name":"sifr-0.1.0-x86_64-apple-darwin.tar.gz.sha256","sha256":"4613c87eacac9a69680cac002a58c3d0338220db52afc98b05c23404aa12c968","size_bytes":65,"target":"x86_64-apple-darwin","workflow_artifact_id":8710519427,"workflow_artifact_name":"sifr-stable-candidate-0.1.0-c9d611fb7c7c5d05421d784d53a2b78c1a7dcae9-x86_64-apple-darwin"},{"expires_at":"2026-08-28T02:18:50Z","id":"checksum-x86_64-unknown-linux-gnu","kind":"checksum","name":"sifr-0.1.0-x86_64-unknown-linux-gnu.tar.gz.sha256","sha256":"a93cbb2399a6c6ddd92c0d8634a3cc4e5ea9b2b1714ff9b7562dc81ccf150852","size_bytes":65,"target":"x86_64-unknown-linux-gnu","workflow_artifact_id":8710332418,"workflow_artifact_name":"sifr-stable-candidate-0.1.0-c9d611fb7c7c5d05421d784d53a2b78c1a7dcae9-x86_64-unknown-linux-gnu"},{"expires_at":"2026-08-28T02:32:17Z","id":"checksums","kind":"checksums","name":"checksums.txt","sha256":"2a074661b76967e398a88c9a838ce853f99b33dd99f61ca5d1e9412dac777e9e","size_bytes":1344,"workflow_artifact_id":8710536142,"workflow_artifact_name":"sifr-stable-candidate-0.1.0-c9d611fb7c7c5d05421d784d53a2b78c1a7dcae9-assemble"},{"expires_at":"2026-08-28T02:32:11Z","id":"editor-qualification-report","kind":"report","name":"qualification-editor.json","sha256":"73a69c3ce7f8f4fa36664f8d35c0a8383641295b986cf49c5593ea3a58d6fe56","size_bytes":1105,"workflow_artifact_id":8710534546,"workflow_artifact_name":"sifr-stable-candidate-0.1.0-c9d611fb7c7c5d05421d784d53a2b78c1a7dcae9-editor"},{"expires_at":"2026-08-28T02:32:17Z","id":"installer","kind":"installer","name":"sifr-installer-0.1.0","sha256":"907e7a4fc6ded693bc4eab568def878197f19f3775327e00cfdea6cb71bb6296","size_bytes":19571,"workflow_artifact_id":8710536142,"workflow_artifact_name":"sifr-stable-candidate-0.1.0-c9d611fb7c7c5d05421d784d53a2b78c1a7dcae9-assemble"},{"expires_at":"2026-08-28T02:18:30Z","id":"qualification-report-aarch64-apple-darwin","kind":"report","name":"qualification-aarch64-apple-darwin.json","sha256":"f720e18a7b26876f1240bf8c7fa8dc5cbd3e4918d241f5c66672c55c78f553d3","size_bytes":880,"workflow_artifact_id":8710327423,"workflow_artifact_name":"sifr-stable-candidate-0.1.0-c9d611fb7c7c5d05421d784d53a2b78c1a7dcae9-aarch64-apple-darwin"},{"expires_at":"2026-08-28T02:17:30Z","id":"qualification-report-aarch64-unknown-linux-gnu","kind":"report","name":"qualification-aarch64-unknown-linux-gnu.json","sha256":"d535d8e2a53430d4d3ea96f7e858655c5a39747b0dd5ab6a30b6f5a78e9eb079","size_bytes":898,"workflow_artifact_id":8710312634,"workflow_artifact_name":"sifr-stable-candidate-0.1.0-c9d611fb7c7c5d05421d784d53a2b78c1a7dcae9-aarch64-unknown-linux-gnu"},{"expires_at":"2026-08-28T02:31:06Z","id":"qualification-report-x86_64-apple-darwin","kind":"report","name":"qualification-x86_64-apple-darwin.json","sha256":"deb5cbb40321ccc25b0fb5a90ff6f4e5a4a767ca59bfb0f8871f19128ae07ea3","size_bytes":884,"workflow_artifact_id":8710519427,"workflow_artifact_name":"sifr-stable-candidate-0.1.0-c9d611fb7c7c5d05421d784d53a2b78c1a7dcae9-x86_64-apple-darwin"},{"expires_at":"2026-08-28T02:18:50Z","id":"qualification-report-x86_64-unknown-linux-gnu","kind":"report","name":"qualification-x86_64-unknown-linux-gnu.json","sha256":"d5f72bbebef8096ca89829e43c4f26b8c148fa04407c424d926a98f5b2107c91","size_bytes":892,"workflow_artifact_id":8710332418,"workflow_artifact_name":"sifr-stable-candidate-0.1.0-c9d611fb7c7c5d05421d784d53a2b78c1a7dcae9-x86_64-unknown-linux-gnu"},{"expires_at":"2026-08-28T02:18:30Z","id":"sysroot-aarch64-apple-darwin","kind":"sysroot","name":"sifr-0.1.0-aarch64-apple-darwin-sysroot.tar.gz","sha256":"f0b20a4eb7f95f63b47fd4fa476bae89be772e6b7c37c43ac2344ccf3e823b37","size_bytes":60831696,"target":"aarch64-apple-darwin","workflow_artifact_id":8710327423,"workflow_artifact_name":"sifr-stable-candidate-0.1.0-c9d611fb7c7c5d05421d784d53a2b78c1a7dcae9-aarch64-apple-darwin"},{"expires_at":"2026-08-28T02:17:30Z","id":"sysroot-aarch64-unknown-linux-gnu","kind":"sysroot","name":"sifr-0.1.0-aarch64-unknown-linux-gnu-sysroot.tar.gz","sha256":"ca194ab09144f610cbbbf135977a3f49ce1c8068aa1d818da1292e6b2e62e403","size_bytes":60832459,"target":"aarch64-unknown-linux-gnu","workflow_artifact_id":8710312634,"workflow_artifact_name":"sifr-stable-candidate-0.1.0-c9d611fb7c7c5d05421d784d53a2b78c1a7dcae9-aarch64-unknown-linux-gnu"},{"expires_at":"2026-08-28T02:31:06Z","id":"sysroot-x86_64-apple-darwin","kind":"sysroot","name":"sifr-0.1.0-x86_64-apple-darwin-sysroot.tar.gz","sha256":"f1a3dfd26338e41ea0e9800d61438dfa3218afc3f22eea709d904953577bbdfb","size_bytes":60832069,"target":"x86_64-apple-darwin","workflow_artifact_id":8710519427,"workflow_artifact_name":"sifr-stable-candidate-0.1.0-c9d611fb7c7c5d05421d784d53a2b78c1a7dcae9-x86_64-apple-darwin"},{"expires_at":"2026-08-28T02:18:50Z","id":"sysroot-x86_64-unknown-linux-gnu","kind":"sysroot","name":"sifr-0.1.0-x86_64-unknown-linux-gnu-sysroot.tar.gz","sha256":"d9963d229e6f8eab95841b636fe6e3b2048449bda211c4c9460561d4f0948fd2","size_bytes":60834944,"target":"x86_64-unknown-linux-gnu","workflow_artifact_id":8710332418,"workflow_artifact_name":"sifr-stable-candidate-0.1.0-c9d611fb7c7c5d05421d784d53a2b78c1a7dcae9-x86_64-unknown-linux-gnu"},{"expires_at":"2026-08-28T02:32:11Z","id":"vsix","kind":"vsix","name":"sifr-vscode-0.2.0.vsix","sha256":"5a6d706b3faca91143f4a6ac3f29dacfee5a4a4d635a726db5a9068ac148eb21","size_bytes":621869,"workflow_artifact_id":8710534546,"workflow_artifact_name":"sifr-stable-candidate-0.1.0-c9d611fb7c7c5d05421d784d53a2b78c1a7dcae9-editor"}],"candidate_version":"0.1.0","schema_version":2,"source_commit":"c9d611fb7c7c5d05421d784d53a2b78c1a7dcae9","submodules":{"editor_integrations":"d7577d49274b97fdf508b7fa16b6d9bdb51b4acd","editor_integrations/vscode":"273fd5d3ebc958124c3151647e2b61136a3ddb06","third_party/ruff":"e024f2a4870568734a3b215226570aab87e396a2","verification/areas/algorithmic_compatibility/corpora/leetcode":"a20d9d5020dae9c19913a598d262ab931924cfe9","verification/areas/developer_tooling/corpora/sifr-large-lsp-verification":"0d26e732fee734806159610e05a33dd6d4d9bed7","verification/areas/package_management/corpora/demo_repositories/sifr-demo-app":"3a9e2ef3bb648125f9be7cc538722be537cbb7f0","verification/areas/package_management/corpora/demo_repositories/sifr-demo-http":"4a9128427fb4f87bf4fbc8f499a00e96eb24a021","verification/areas/package_management/corpora/demo_repositories/sifr-demo-json":"8eca97bbf83c5f986505ed980acf2c1f458cbacf","verification/areas/package_management/corpora/demo_repositories/sifr-demo-test-support":"e8a1f5f9b1e4ffad12fdbd656b2d68d8b7fd13fb","verification/areas/package_management/corpora/demo_repositories/sifr-demo-workspace":"13586edda82d0ed2e0bec487c10228af22d41e48"},"workflow":{"expires_at":"2026-08-28T02:17:30Z","overwrite":false,"repository":"sifr-lang/sifr","retention_days":30,"run_attempt":1,"run_id":30416219284}}
